{"advances_authority":false,"approves_work":false,"deploys":false,"dynamic_fanout":false,"events":[],"events_digest":"sha256:4f53cda18c2baa0c0354bb5f9a3ecbe5ed12ab4d8e11ba873c2f11161202b945","executes_work":false,"first_sequence":0,"grants_provider_access":false,"journal_identity":{"model_profile_digest":"sha256:011dc9b9e8a50ea9668e85d249d5e93f1f054e0a9bde9a48051003de6323b10f","policy_digest":"sha256:0000000000000000000000000000000000000000000000000000000000000000","request_digest":"sha256:e63e21aefcceea4e0da8c75482ac6bc33c7b0f1ec43645a8e8961683fb568d93","source_digest":"sha256:04c7d792ea732f7130634150095378f57751b2016922d98e890c6fd54ea9cd95","verifier_profile_digest":"sha256:1111111111111111111111111111111111111111111111111111111111111111","workspace_digest":"sha256:1442e94e69076fc627dd00fd5408edad1498e798c7da7b077b42d70515050e35"},"last_sequence":null,"mutates_repositories":false,"preceding_prefix_digest":null,"prefix_digest":"sha256:b7d3e57be5cd1b70fee8c142fd79ce98ef74e90abd26b8bac448c775e37725d7","publishes_artifacts":false,"releases":false,"request_digest":"sha256:e63e21aefcceea4e0da8c75482ac6bc33c7b0f1ec43645a8e8961683fb568d93","run_id":"run-stage1-export","safe_to_execute":false,"schema_version":"ao.next.execution-journal-prefix.v1","terminal_digest":null,"terminal_record":null,"worker_count":1}
