{"advances_authority":false,"approves_work":false,"deploys":false,"dynamic_fanout":false,"events":[{"kind":{"execution_authority_digest":"sha256:1111111111111111111111111111111111111111111111111111111111111111","kind":"provider_request_intent","prepared_run_digest":"sha256:0000000000000000000000000000000000000000000000000000000000000000"},"schema_version":"ao.next.journal-event.v1","sequence":0},{"kind":{"invocation_digest":"sha256:0000000000000000000000000000000000000000000000000000000000000000","kind":"provider_process_started"},"schema_version":"ao.next.journal-event.v1","sequence":1}],"events_digest":"sha256:2795283707a7ef71b62c5079b3f1b7688ac0b23c5f4cff5d5cee955d3611318c","executes_work":false,"first_sequence":0,"grants_provider_access":false,"journal_identity":{"model_profile_digest":"sha256:011dc9b9e8a50ea9668e85d249d5e93f1f054e0a9bde9a48051003de6323b10f","policy_digest":"sha256:0000000000000000000000000000000000000000000000000000000000000000","request_digest":"sha256:e63e21aefcceea4e0da8c75482ac6bc33c7b0f1ec43645a8e8961683fb568d93","source_digest":"sha256:04c7d792ea732f7130634150095378f57751b2016922d98e890c6fd54ea9cd95","verifier_profile_digest":"sha256:1111111111111111111111111111111111111111111111111111111111111111","workspace_digest":"sha256:1442e94e69076fc627dd00fd5408edad1498e798c7da7b077b42d70515050e35"},"last_sequence":1,"mutates_repositories":false,"preceding_prefix_digest":null,"prefix_digest":"sha256:f4d72f995153ecd02fa10a98b8d8040bd848fc77033300e61628f23759f13a29","publishes_artifacts":false,"releases":false,"request_digest":"sha256:e63e21aefcceea4e0da8c75482ac6bc33c7b0f1ec43645a8e8961683fb568d93","run_id":"run-stage1-export","safe_to_execute":false,"schema_version":"ao.next.execution-journal-prefix.v1","terminal_digest":null,"terminal_record":null,"worker_count":1}
