{"advances_authority":false,"approves_work":false,"deploys":false,"dynamic_fanout":false,"events":[{"kind":{"effect_id":"rust line literal \\u2028 \\u2029","kind":"effect_committed"},"schema_version":"ao.next.journal-event.v1","sequence":0},{"kind":{"attempt":0,"kind":"verification_started"},"schema_version":"ao.next.journal-event.v1","sequence":1},{"kind":{"kind":"verifier_recorded","report_digest":"sha256:1111111111111111111111111111111111111111111111111111111111111111"},"schema_version":"ao.next.journal-event.v1","sequence":2},{"kind":{"kind":"terminal_published","record_digest":"sha256:b51348e466dca10abb8f58a05e11e313842feccd58c7b10366c24b679697d6ab"},"schema_version":"ao.next.journal-event.v1","sequence":3}],"events_digest":"sha256:ffd4a07d44fb5e54e7162aae74cea463623cc2c2a32c94e6419d1737ac9b3c91","executes_work":false,"first_sequence":0,"grants_provider_access":false,"journal_identity":{"model_profile_digest":"sha256:011dc9b9e8a50ea9668e85d249d5e93f1f054e0a9bde9a48051003de6323b10f","policy_digest":"sha256:0000000000000000000000000000000000000000000000000000000000000000","request_digest":"sha256:e63e21aefcceea4e0da8c75482ac6bc33c7b0f1ec43645a8e8961683fb568d93","source_digest":"sha256:04c7d792ea732f7130634150095378f57751b2016922d98e890c6fd54ea9cd95","verifier_profile_digest":"sha256:1111111111111111111111111111111111111111111111111111111111111111","workspace_digest":"sha256:1442e94e69076fc627dd00fd5408edad1498e798c7da7b077b42d70515050e35"},"last_sequence":3,"mutates_repositories":false,"preceding_prefix_digest":null,"prefix_digest":"sha256:aff649edd7d6959d287302e609ca50e53320ab09a3cba24049bce5fc19d2f35e","publishes_artifacts":false,"releases":false,"request_digest":"sha256:e63e21aefcceea4e0da8c75482ac6bc33c7b0f1ec43645a8e8961683fb568d93","run_id":"run-stage1-export","safe_to_execute":false,"schema_version":"ao.next.execution-journal-prefix.v1","terminal_digest":"sha256:b51348e466dca10abb8f58a05e11e313842feccd58c7b10366c24b679697d6ab","terminal_record":{"ao2_control_diagnostics":[],"capture_digests":["sha256:0000000000000000000000000000000000000000000000000000000000000000"],"git_workspace":{"branch":"ao-next-sealed-seed","common_dir":"/tmp/ao-next-stage1-journal-prefix/.git","control_digest":"sha256:0000000000000000000000000000000000000000000000000000000000000000","head_commit":"0123456789abcdef0123456789abcdef01234567","index_digest":"sha256:1111111111111111111111111111111111111111111111111111111111111111","repository_root":"/tmp/ao-next-stage1-journal-prefix"},"measurement":{"accepted_changed_files":0,"adapter_digest":"sha256:1111111111111111111111111111111111111111111111111111111111111111","adapter_version":"scripted-v1","changed_files":0,"corpus_digest":"sha256:1111111111111111111111111111111111111111111111111111111111111111","cross_runtime_agreement":true,"dynamic_fanout":false,"evidence_complete":true,"evidence_digest_valid":true,"hidden_test_exposure":false,"hidden_tests_digest":"sha256:1111111111111111111111111111111111111111111111111111111111111111","hidden_tests_passed":1,"hidden_tests_total":1,"measurement_origin":"offline_fixture","model_digest":"sha256:1111111111111111111111111111111111111111111111111111111111111111","model_identifier":"rust line literal \\u2028 \\u2029","model_wait_ms":7,"objective_digest":"sha256:0000000000000000000000000000000000000000000000000000000000000000","operator_interventions":0,"policy_digest":"sha256:0000000000000000000000000000000000000000000000000000000000000000","prompt_digest":"sha256:0000000000000000000000000000000000000000000000000000000000000000","provider_usage_trusted":true,"raw_capture_digest":"sha256:88c79367850f5af2657f7f92cb3f7b2001e08fbd686904322efc169cdbac1b38","raw_capture_digests":["sha256:0000000000000000000000000000000000000000000000000000000000000000"],"recovery_attempted":false,"recovery_no_duplicate_effect":false,"regressions":0,"repair_attempts":0,"run_id":"run-stage1-export","runtime":"scripted","runtime_digest":"sha256:0000000000000000000000000000000000000000000000000000000000000000","schedule_position":0,"schema_version":"ao.next.run-measurement.v2","source_digest":"sha256:0000000000000000000000000000000000000000000000000000000000000000","task_id":"stage1-journal-prefix","task_success":true,"tokens":{"cached_input_tokens":7,"input_tokens":11,"output_tokens":13,"reasoning_tokens":5,"reported_total_tokens":36},"trial_id":"trial-stage1-export","trial_index":0,"unauthorized_effects":0,"variant":"N7","verifier_profile_digest":"sha256:1111111111111111111111111111111111111111111111111111111111111111","visible_fixtures_digest":"sha256:0000000000000000000000000000000000000000000000000000000000000000","wall_clock_ms":10,"worker_count":1,"worker_turns":1,"workspace_instance_id":"workspace-stage1-export","workspace_seed_digest":"sha256:1111111111111111111111111111111111111111111111111111111111111111"},"n7_execution_authority_digest":"sha256:1111111111111111111111111111111111111111111111111111111111111111","native_effect_observations":[],"raw_capture_index_digest":"sha256:1111111111111111111111111111111111111111111111111111111111111111","record_digest":"sha256:4ec10dfa652a5c026f48542fc279ef31fd0dddf6b9eea2d594d1f3edd8097c94","schema_version":"ao.next.live-run-record.v1","terminal_state":"passed","variant":"N7","verifier_report_digest":"sha256:1111111111111111111111111111111111111111111111111111111111111111"},"worker_count":1}